<?xml version="1.0" encoding="UTF-8"?>
<thesaurus dc:URI="http://rs.tdwg.org/dwc/dwctype/" dc:description="http://www.niiss.org/cwis438/websites/GISINDirectory/tech/Concept_Info.php?ConceptID=5" dc:title="Darwin Core Type Vocabulary" xmlns="http://data.gbif.org/thesaurus" xmlns:dc="http://purl.org/dc/terms/" xmlns:xsi="http://www.w3.org/2001/XMLSchema-instance" 
	xsi:schemaLocation="http://data.gbif.org/thesaurus  http://gbrds.gbif.org/resources/schemas/thesaurus.xsd">
 
 <concept dc:identifier="Common" dc:URI="http://www.gisinetwork.org/IASProfile/Abundance/terms/Common" dc:description="http://www.niiss.org/cwis438/websites/GISINDirectory/tech/Concept_Info.php?ConceptID=5" dc:issued="2009-04-01T01:01:01+00:00">
  <preferred>
   <term dc:modified="2009-01-01T01:01:01+00:00" dc:source="" dc:title="Common" xml:lang="en"/>
  </preferred>
  <alternative>
  </alternative>
 </concept>
 
 <concept dc:identifier="Dominant" dc:URI="http://www.gisinetwork.org/IASProfile/Abundance/terms/Dominant" dc:description="http://www.niiss.org/cwis438/websites/GISINDirectory/tech/Concept_Info.php?ConceptID=5" dc:issued="2009-04-01T01:01:01+00:00">
  <preferred>
   <term dc:modified="2009-01-01T01:01:01+00:00" dc:source="" dc:title="Dominant" xml:lang="en"/>
  </preferred>
  <alternative>
  </alternative>
 </concept>
 
 <concept dc:identifier="Monoculture" dc:URI="http://www.gisinetwork.org/IASProfile/Abundance/terms/Monoculture" dc:description="http://www.niiss.org/cwis438/websites/GISINDirectory/tech/Concept_Info.php?ConceptID=5" dc:issued="2009-04-01T01:01:01+00:00">
  <preferred>
   <term dc:modified="2009-01-01T01:01:01+00:00" dc:source="" dc:title="Monoculture" xml:lang="en"/>
  </preferred>
  <alternative>
  </alternative>
 </concept>
 
 <concept dc:identifier="Rare" dc:URI="http://www.gisinetwork.org/IASProfile/Abundance/terms/Rare" dc:description="http://www.niiss.org/cwis438/websites/GISINDirectory/tech/Concept_Info.php?ConceptID=5" dc:issued="2009-04-01T01:01:01+00:00">
  <preferred>
   <term dc:modified="2009-01-01T01:01:01+00:00" dc:source="" dc:title="Rare" xml:lang="en"/>
  </preferred>
  <alternative>
  </alternative>
 </concept>
 
 <concept dc:identifier="Unknown" dc:URI="http://www.gisinetwork.org/IASProfile/Abundance/terms/Unknown" dc:description="http://www.niiss.org/cwis438/websites/GISINDirectory/tech/Concept_Info.php?ConceptID=5" dc:issued="2009-04-01T01:01:01+00:00">
  <preferred>
   <term dc:modified="2009-01-01T01:01:01+00:00" dc:source="" dc:title="Unknown" xml:lang="en"/>
  </preferred>
  <alternative>
  </alternative>
 </concept>
 
 <concept dc:identifier="Zero" dc:URI="http://www.gisinetwork.org/IASProfile/Abundance/terms/Zero" dc:description="http://www.niiss.org/cwis438/websites/GISINDirectory/tech/Concept_Info.php?ConceptID=5" dc:issued="2009-04-01T01:01:01+00:00">
  <preferred>
   <term dc:modified="2009-01-01T01:01:01+00:00" dc:source="" dc:title="Zero" xml:lang="en"/>
  </preferred>
  <alternative>
  </alternative>
 </concept>

</thesaurus>