<?xml version="1.0" encoding="UTF-8"?>
<thesaurus dc:URI="http://rs.tdwg.org/dwc/dwctype/" dc:description="http://www.niiss.org/cwis438/websites/GISINDirectory/tech/Concept_Info.php?ConceptID=4" dc:title="Darwin Core Type Vocabulary" xmlns="http://data.gbif.org/thesaurus" xmlns:dc="http://purl.org/dc/terms/" xmlns:xsi="http://www.w3.org/2001/XMLSchema-instance" 
	xsi:schemaLocation="http://data.gbif.org/thesaurus  http://gbrds.gbif.org/resources/schemas/thesaurus.xsd">

 <concept dc:identifier="Unknown" dc:URI="http://www.gisinetwork.org/IASProfile/Distribution/terms/Unknown" dc:description="http://www.niiss.org/cwis438/websites/GISINDirectory/tech/Concept_Info.php?ConceptID=4" dc:issued="2009-04-01T01:01:01+00:00">
  <preferred>
   <term dc:modified="2009-01-01T01:01:01+00:00" dc:source="" dc:title="Unknown" xml:lang="en"/>
  </preferred>
  <alternative>
  </alternative>
 </concept>
 
 <concept dc:identifier="Localized" dc:URI="http://www.gisinetwork.org/IASProfile/Distribution/terms/Localized" dc:description="http://www.niiss.org/cwis438/websites/GISINDirectory/tech/Concept_Info.php?ConceptID=4" dc:issued="2009-04-01T01:01:01+00:00">
  <preferred>
   <term dc:modified="2009-01-01T01:01:01+00:00" dc:source="" dc:title="Localized" xml:lang="en"/>
  </preferred>
  <alternative>
  </alternative>
 </concept>
 
 <concept dc:identifier="Moderate" dc:URI="http://www.gisinetwork.org/IASProfile/Distribution/terms/Moderate" dc:description="http://www.niiss.org/cwis438/websites/GISINDirectory/tech/Concept_Info.php?ConceptID=4" dc:issued="2009-04-01T01:01:01+00:00">
  <preferred>
   <term dc:modified="2009-01-01T01:01:01+00:00" dc:source="" dc:title="Moderate" xml:lang="en"/>
  </preferred>
  <alternative>
  </alternative>
 </concept>
 
 <concept dc:identifier="Widespread" dc:URI="http://www.gisinetwork.org/IASProfile/Distribution/terms/Widespread" dc:description="http://www.niiss.org/cwis438/websites/GISINDirectory/tech/Concept_Info.php?ConceptID=4" dc:issued="2009-04-01T01:01:01+00:00">
  <preferred>
   <term dc:modified="2009-01-01T01:01:01+00:00" dc:source="" dc:title="Widespread" xml:lang="en"/>
  </preferred>
  <alternative>
  </alternative>
 </concept>
 
</thesaurus>