<?xml version="1.0" encoding="UTF-8"?>
<thesaurus dc:URI="http://rs.tdwg.org/dwc/dwctype/" dc:description="http://www.niiss.org/cwis438/websites/GISINDirectory/tech/Concept_Info.php?ConceptID=3" dc:title="Darwin Core Type Vocabulary" xmlns="http://data.gbif.org/thesaurus" xmlns:dc="http://purl.org/dc/terms/" xmlns:xsi="http://www.w3.org/2001/XMLSchema-instance" 
	xsi:schemaLocation="http://data.gbif.org/thesaurus  http://gbrds.gbif.org/resources/schemas/thesaurus.xsd">

 <concept dc:identifier="Unknown" dc:URI="http://www.gisinetwork.org/IASProfile/Abundance/terms/Unknown" dc:description="http://www.niiss.org/cwis438/websites/GISINDirectory/tech/Concept_Info.php?ConceptID=3" dc:issued="2009-04-01T01:01:01+00:00">
  <preferred>
   <term dc:modified="2009-01-01T01:01:01+00:00" dc:source="" dc:title="Unknown" xml:lang="en"/>
  </preferred>
  <alternative>
  </alternative>
 </concept>
 
 <concept dc:identifier="DiedOut" dc:URI="http://www.gisinetwork.org/IASProfile/Abundance/terms/DiedOut" dc:description="http://www.niiss.org/cwis438/websites/GISINDirectory/tech/Concept_Info.php?ConceptID=3" dc:issued="2009-04-01T01:01:01+00:00">
  <preferred>
   <term dc:modified="2009-01-01T01:01:01+00:00" dc:source="" dc:title="DiedOut" xml:lang="en"/>
  </preferred>
  <alternative>
  </alternative>
 </concept>
 
 <concept dc:identifier="Transient" dc:URI="http://www.gisinetwork.org/IASProfile/Abundance/terms/Transient" dc:description="http://www.niiss.org/cwis438/websites/GISINDirectory/tech/Concept_Info.php?ConceptID=3" dc:issued="2009-04-01T01:01:01+00:00">
  <preferred>
   <term dc:modified="2009-01-01T01:01:01+00:00" dc:source="" dc:title="Transient" xml:lang="en"/>
  </preferred>
  <alternative>
  </alternative>
 </concept>
 
 <concept dc:identifier="Temporary" dc:URI="http://www.gisinetwork.org/IASProfile/Abundance/terms/Temporary" dc:description="http://www.niiss.org/cwis438/websites/GISINDirectory/tech/Concept_Info.php?ConceptID=3" dc:issued="2009-04-01T01:01:01+00:00">
  <preferred>
   <term dc:modified="2009-01-01T01:01:01+00:00" dc:source="" dc:title="Temporary" xml:lang="en"/>
  </preferred>
  <alternative>
  </alternative>
 </concept>
 
 <concept dc:identifier="Persistent" dc:URI="http://www.gisinetwork.org/IASProfile/Abundance/terms/Persistent" dc:description="http://www.niiss.org/cwis438/websites/GISINDirectory/tech/Concept_Info.php?ConceptID=3" dc:issued="2009-04-01T01:01:01+00:00">
  <preferred>
   <term dc:modified="2009-01-01T01:01:01+00:00" dc:source="" dc:title="Persistent" xml:lang="en"/>
  </preferred>
  <alternative>
  </alternative>
 </concept>
 
</thesaurus>